{
  "v": 1,
  "shop": "01k5a8m2q7w3x9z4b6c8d0e2f4",
  "vid": "anon-7f3a9c2e1b4d6f80",
  "session": "s-4b1e9a77",
  "sent_at": 1758040123456,
  "holdout": false,
  "events": [
    {
      "id": "e-01k5a8m2q7w3x9z4b6",
      "type": "exposure",
      "ts": 1758040120000,
      "page": {
        "type": "product",
        "path": "/product/stanley-hammer-16oz",
        "product_id": "p_1234",
        "group_id": "hammers-16oz",
        "category_path": [
          "כלי עבודה",
          "כלי יד",
          "פטישים"
        ]
      },
      "candidate": {
        "id": "position_price_hammers",
        "version": 3,
        "model": "position",
        "slot": "teaser"
      },
      "bank_version": 42,
      "eligible": [
        "position_price_hammers",
        "faq_hammer_v3",
        "cmp_hammers"
      ],
      "bucket": "same_family_seen",
      "data": {
        "visible_ms": 1800,
        "ratio": 1
      }
    },
    {
      "id": "e-01k5a8m2q7w3x9z4b7",
      "type": "open",
      "ts": 1758040121000,
      "page": {
        "type": "product",
        "path": "/product/stanley-hammer-16oz",
        "product_id": "p_1234"
      },
      "candidate": {
        "id": "position_price_hammers",
        "version": 3,
        "model": "position",
        "slot": "teaser"
      },
      "bank_version": 42,
      "eligible": [
        "position_price_hammers",
        "faq_hammer_v3",
        "cmp_hammers"
      ],
      "bucket": "same_family_seen"
    },
    {
      "id": "e-01k5a8m2q7w3x9z4b8",
      "type": "answer",
      "ts": 1758040122000,
      "page": {
        "type": "product",
        "path": "/product/stanley-hammer-16oz",
        "product_id": "p_1234"
      },
      "bucket": "hesitation",
      "data": {
        "question": "why_not",
        "answer": "price",
        "product_id": "p_1234"
      }
    },
    {
      "id": "e-01k5a8m2q7w3x9z4b9",
      "type": "add_to_cart",
      "ts": 1758040123000,
      "page": {
        "type": "product",
        "path": "/product/stanley-hammer-16oz",
        "product_id": "p_1234"
      },
      "data": {
        "source": "page",
        "product_id": "p_1234",
        "variant_id": "v_1",
        "quantity": 1,
        "result": "added"
      }
    },
    {
      "id": "e-01k5a8m2q7w3x9z4c1",
      "type": "add_to_cart",
      "ts": 1758040123200,
      "page": {
        "type": "product",
        "path": "/product/stanley-hammer-16oz",
        "product_id": "p_1234"
      },
      "candidate": {
        "id": "cmp_nails_for_16oz",
        "version": 2,
        "model": "complement",
        "slot": "panel"
      },
      "bank_version": 42,
      "eligible": [
        "position_price_hammers",
        "cmp_nails_for_16oz"
      ],
      "bucket": "same_family_seen",
      "data": {
        "source": "widget",
        "product_id": "p_777",
        "quantity": 1,
        "result": "added"
      }
    },
    {
      "id": "e-01k5a8m2q7w3x9z4ba",
      "type": "chat_question",
      "ts": 1758040123400,
      "page": {
        "type": "product",
        "path": "/product/stanley-hammer-16oz"
      },
      "data": {
        "length": 42,
        "answered_from": "rag"
      }
    }
  ]
}
